RecipeName,Ingredients,Instructions
Strawberries Delight,"strawberries, eggplant, cucumber, lamb, bread","Combine strawberries, eggplant, cucumber, lamb and bread. Cook until done. Adjust seasoning to taste. Serve hot."
Olive Oil Pasta,"olive oil, mushrooms",Combine olive oil and mushrooms. Cook until done. Adjust seasoning to taste. Serve hot.
Pie Crust Casserole,"pie crust, beef, vinegar, avocado, chickpeas, bread","Combine pie crust, beef, vinegar, avocado, chickpeas and bread. Cook until done. Adjust seasoning to taste. Serve hot."
Water Delight,"water, lettuce, strawberries, broth, salsa","Combine water, lettuce, strawberries, broth and salsa. Cook until done. Adjust seasoning to taste. Serve hot."
Croutons Soup,"croutons, strawberries, pie crust","Combine croutons, strawberries and pie crust. Cook until done. Adjust seasoning to taste. Serve hot."
Blueberries Tart,"blueberries, garlic",Combine blueberries and garlic. Cook until done. Adjust seasoning to taste. Serve hot.
Zucchini Frittata,"zucchini, bananas, chocolate, lemons, balsamic, cream","Combine zucchini, bananas, chocolate, lemons, balsamic and cream. Cook until done. Adjust seasoning to taste. Serve hot."
Mustard Bake,"mustard, blueberries, lamb","Combine mustard, blueberries and lamb. Cook until done. Adjust seasoning to taste. Serve hot."
Dill Bake,"dill, strawberries, mussels, shrimp, lettuce, water","Combine dill, strawberries, mussels, shrimp, lettuce and water. Cook until done. Adjust seasoning to taste. Serve hot."
Rosemary Delight,"rosemary, mayonnaise",Combine rosemary and mayonnaise. Cook until done. Adjust seasoning to taste. Serve hot.
Parsley Skillet,"parsley, curry powder",Combine parsley and curry powder. Cook until done. Adjust seasoning to taste. Serve hot.
Tortilla Stir-Fry,"tortilla, tortillas, tomatoes, mustard","Combine tortilla, tortillas, tomatoes and mustard. Cook until done. Adjust seasoning to taste. Serve hot."
Vinegar Casserole,"vinegar, flour",Combine vinegar and flour. Cook until done. Adjust seasoning to taste. Serve hot.
Curry Powder Bake,"curry powder, milk, soy sauce, mushrooms, parsley","Combine curry powder, milk, soy sauce, mushrooms and parsley. Cook until done. Adjust seasoning to taste. Serve hot."
Zucchini Skillet,"zucchini, mushrooms, bread, tuna, honey, eggplant","Combine zucchini, mushrooms, bread, tuna, honey and eggplant. Cook until done. Adjust seasoning to taste. Serve hot."
Flour Pasta,"flour, cheese",Combine flour and cheese. Cook until done. Adjust seasoning to taste. Serve hot.
Mussels Skillet,"mussels, lemons, mixed vegetables","Combine mussels, lemons and mixed vegetables. Cook until done. Adjust seasoning to taste. Serve hot."
Apples Casserole,"apples, lemon",Combine apples and lemon. Cook until done. Adjust seasoning to taste. Serve hot.
Flour Bake,"flour, bun, caesar dressing, breadcrumbs","Combine flour, bun, caesar dressing and breadcrumbs. Cook until done. Adjust seasoning to taste. Serve hot."
Peas Delight,"peas, spinach, saffron, onion, bun","Combine peas, spinach, saffron, onion and bun. Cook until done. Adjust seasoning to taste. Serve hot."
Milk Skillet,"milk, soy sauce",Combine milk and soy sauce. Cook until done. Adjust seasoning to taste. Serve hot.
Tomatoes Pasta,"tomatoes, lentils, mussels, avocado, honey, onion","Combine tomatoes, lentils, mussels, avocado, honey and onion. Cook until done. Adjust seasoning to taste. Serve hot."
Spinach Frittata,"spinach, eggplant",Combine spinach and eggplant. Cook until done. Adjust seasoning to taste. Serve hot.
Chickpeas Soup,"chickpeas, mushrooms, zucchini, carrots, flour, lamb","Combine chickpeas, mushrooms, zucchini, carrots, flour and lamb. Cook until done. Adjust seasoning to taste. Serve hot."
Celery Pasta,"celery, bell peppers, chickpeas, parsley, garlic","Combine celery, bell peppers, chickpeas, parsley and garlic. Cook until done. Adjust seasoning to taste. Serve hot."
Potatoes Salad,"potatoes, blueberries, mixed vegetables, eggs","Combine potatoes, blueberries, mixed vegetables and eggs. Cook until done. Adjust seasoning to taste. Serve hot."
Tomatoes Bake,"tomatoes, tortillas, coconut milk, pepper, bun","Combine tomatoes, tortillas, coconut milk, pepper and bun. Cook until done. Adjust seasoning to taste. Serve hot."
Apples Pasta,"apples, mustard, lettuce, tuna","Combine apples, mustard, lettuce and tuna. Cook until done. Adjust seasoning to taste. Serve hot."
Pasta Frittata,"pasta, lettuce, parsley, yogurt","Combine pasta, lettuce, parsley and yogurt. Cook until done. Adjust seasoning to taste. Serve hot."
Lamb Salad,"lamb, lentils, tortilla","Combine lamb, lentils and tortilla. Cook until done. Adjust seasoning to taste. Serve hot."
Lemons Casserole,"lemons, chocolate, mustard, honey, vinegar","Combine lemons, chocolate, mustard, honey and vinegar. Cook until done. Adjust seasoning to taste. Serve hot."
Eggplant Skillet,"eggplant, lentils, mushrooms, garlic, mustard, mixed vegetables","Combine eggplant, lentils, mushrooms, garlic, mustard and mixed vegetables. Cook until done. Adjust seasoning to taste. Serve hot."
Coconut Milk Casserole,"coconut milk, tomato sauce, shrimp, cinnamon, soy sauce, banana","Combine coconut milk, tomato sauce, shrimp, cinnamon, soy sauce and banana. Cook until done. Adjust seasoning to taste. Serve hot."
Pasta Pasta,"pasta, honey, bell peppers","Combine pasta, honey and bell peppers. Cook until done. Adjust seasoning to taste. Serve hot."
Carrots Bake,"carrots, vinegar, lamb, dill, eggs","Combine carrots, vinegar, lamb, dill and eggs. Cook until done. Adjust seasoning to taste. Serve hot."
Mushrooms Frittata,"mushrooms, blueberries, peas, tomatoes, potatoes","Combine mushrooms, blueberries, peas, tomatoes and potatoes. Cook until done. Adjust seasoning to taste. Serve hot."
Salt Stir-Fry,"salt, rosemary, onions, shrimp, bananas","Combine salt, rosemary, onions, shrimp and bananas. Cook until done. Adjust seasoning to taste. Serve hot."
Tomatoes Bake,"tomatoes, vinegar, bread, bun, eggplant, milk","Combine tomatoes, vinegar, bread, bun, eggplant and milk. Cook until done. Adjust seasoning to taste. Serve hot."
Basil Skillet,"basil, strawberries, water, olive oil, lettuce, parsley","Combine basil, strawberries, water, olive oil, lettuce and parsley. Cook until done. Adjust seasoning to taste. Serve hot."
Broth Salad,"broth, fish",Combine broth and fish. Cook until done. Adjust seasoning to taste. Serve hot.
Salmon Stir-Fry,"salmon, spinach, tomato, sugar, cucumber, peas","Combine salmon, spinach, tomato, sugar, cucumber and peas. Cook until done. Adjust seasoning to taste. Serve hot."
Peppers Delight,"peppers, tomato sauce, rosemary, cheese, mayonnaise","Combine peppers, tomato sauce, rosemary, cheese and mayonnaise. Cook until done. Adjust seasoning to taste. Serve hot."
Bun Bake,"bun, honey, onions, bread, butter","Combine bun, honey, onions, bread and butter. Cook until done. Adjust seasoning to taste. Serve hot."
Lemon Tart,"lemon, lime, pepper, cream","Combine lemon, lime, pepper and cream. Cook until done. Adjust seasoning to taste. Serve hot."
Mayonnaise Stir-Fry,"mayonnaise, pie crust, broth, pasta, peas","Combine mayonnaise, pie crust, broth, pasta and peas. Cook until done. Adjust seasoning to taste. Serve hot."
Lamb Skillet,"lamb, basil",Combine lamb and basil. Cook until done. Adjust seasoning to taste. Serve hot.
Lime Skillet,"lime, water",Combine lime and water. Cook until done. Adjust seasoning to taste. Serve hot.
Eggplant Tart,"eggplant, salmon, chocolate","Combine eggplant, salmon and chocolate. Cook until done. Adjust seasoning to taste. Serve hot."
Lettuce Casserole,"lettuce, spinach, parmesan","Combine lettuce, spinach and parmesan. Cook until done. Adjust seasoning to taste. Serve hot."
Olive Oil Bake,"olive oil, vegetables, cinnamon","Combine olive oil, vegetables and cinnamon. Cook until done. Adjust seasoning to taste. Serve hot."
Mustard Frittata,"mustard, banana, tortillas, coconut milk, peas","Combine mustard, banana, tortillas, coconut milk and peas. Cook until done. Adjust seasoning to taste. Serve hot."
Mussels Skillet,"mussels, apples, croutons, cream, garlic","Combine mussels, apples, croutons, cream and garlic. Cook until done. Adjust seasoning to taste. Serve hot."
Bun Casserole,"bun, salt, cinnamon, mixed vegetables, lentils, coconut milk","Combine bun, salt, cinnamon, mixed vegetables, lentils and coconut milk. Cook until done. Adjust seasoning to taste. Serve hot."
Fish Tart,"fish, pumpkin",Combine fish and pumpkin. Cook until done. Adjust seasoning to taste. Serve hot.
Tomatoes Frittata,"tomatoes, mussels, tortillas, mustard","Combine tomatoes, mussels, tortillas and mustard. Cook until done. Adjust seasoning to taste. Serve hot."
Mayonnaise Casserole,"mayonnaise, milk",Combine mayonnaise and milk. Cook until done. Adjust seasoning to taste. Serve hot.
Chocolate Stir-Fry,"chocolate, lamb, tortillas, tomato sauce, bread, carrots","Combine chocolate, lamb, tortillas, tomato sauce, bread and carrots. Cook until done. Adjust seasoning to taste. Serve hot."
Dill Skillet,"dill, lemon",Combine dill and lemon. Cook until done. Adjust seasoning to taste. Serve hot.
Mozzarella Pasta,"mozzarella, celery, saffron","Combine mozzarella, celery and saffron. Cook until done. Adjust seasoning to taste. Serve hot."
Tomatoes Bake,"tomatoes, carrots, sugar, mussels, parmesan","Combine tomatoes, carrots, sugar, mussels and parmesan. Cook until done. Adjust seasoning to taste. Serve hot."
Vinegar Bake,"vinegar, salt, water, chocolate, spinach","Combine vinegar, salt, water, chocolate and spinach. Cook until done. Adjust seasoning to taste. Serve hot."
Ginger Frittata,"ginger, carrots, cinnamon, lemons, peas","Combine ginger, carrots, cinnamon, lemons and peas. Cook until done. Adjust seasoning to taste. Serve hot."
Milk Casserole,"milk, avocado",Combine milk and avocado. Cook until done. Adjust seasoning to taste. Serve hot.
Cocoa Powder Tart,"cocoa powder, mussels, spinach","Combine cocoa powder, mussels and spinach. Cook until done. Adjust seasoning to taste. Serve hot."
Onion Skillet,"onion, pumpkin, onions, pasta, chickpeas","Combine onion, pumpkin, onions, pasta and chickpeas. Cook until done. Adjust seasoning to taste. Serve hot."
Banana Tart,"banana, cucumber, honey, bananas, garlic, yogurt","Combine banana, cucumber, honey, bananas, garlic and yogurt. Cook until done. Adjust seasoning to taste. Serve hot."
Chickpeas Tart,"chickpeas, pepper, strawberries, rice","Combine chickpeas, pepper, strawberries and rice. Cook until done. Adjust seasoning to taste. Serve hot."
Butter Tart,"butter, sugar, zucchini, flour, shrimp, mixed vegetables","Combine butter, sugar, zucchini, flour, shrimp and mixed vegetables. Cook until done. Adjust seasoning to taste. Serve hot."
Pasta Salad,"pasta, shrimp",Combine pasta and shrimp. Cook until done. Adjust seasoning to taste. Serve hot.
Bun Casserole,"bun, yogurt, eggplant, lamb, bananas","Combine bun, yogurt, eggplant, lamb and bananas. Cook until done. Adjust seasoning to taste. Serve hot."
Mayonnaise Salad,"mayonnaise, breadcrumbs, pasta, cabbage","Combine mayonnaise, breadcrumbs, pasta and cabbage. Cook until done. Adjust seasoning to taste. Serve hot."
Tomato Sauce Pasta,"tomato sauce, mayonnaise, tortillas","Combine tomato sauce, mayonnaise and tortillas. Cook until done. Adjust seasoning to taste. Serve hot."
Tortillas Salad,"tortillas, carrots, cream","Combine tortillas, carrots and cream. Cook until done. Adjust seasoning to taste. Serve hot."
Strawberries Tart,"strawberries, mayonnaise",Combine strawberries and mayonnaise. Cook until done. Adjust seasoning to taste. Serve hot.
Tomatoes Soup,"tomatoes, salt, chickpeas, lentils","Combine tomatoes, salt, chickpeas and lentils. Cook until done. Adjust seasoning to taste. Serve hot."
Sugar Bake,"sugar, flour, saffron, broth","Combine sugar, flour, saffron and broth. Cook until done. Adjust seasoning to taste. Serve hot."
Beef Bake,"beef, garlic, yogurt, caesar dressing, eggplant","Combine beef, garlic, yogurt, caesar dressing and eggplant. Cook until done. Adjust seasoning to taste. Serve hot."
Eggplant Frittata,"eggplant, mustard, pumpkin, celery","Combine eggplant, mustard, pumpkin and celery. Cook until done. Adjust seasoning to taste. Serve hot."
Vegetables Skillet,"vegetables, onions, mushrooms, peas","Combine vegetables, onions, mushrooms and peas. Cook until done. Adjust seasoning to taste. Serve hot."
Olive Oil Soup,"olive oil, saffron",Combine olive oil and saffron. Cook until done. Adjust seasoning to taste. Serve hot.
Pepper Delight,"pepper, pumpkin, lentils, tomato","Combine pepper, pumpkin, lentils and tomato. Cook until done. Adjust seasoning to taste. Serve hot."
Pepper Stir-Fry,"pepper, vinegar",Combine pepper and vinegar. Cook until done. Adjust seasoning to taste. Serve hot.
Salt Salad,"salt, mustard",Combine salt and mustard. Cook until done. Adjust seasoning to taste. Serve hot.
Croutons Stir-Fry,"croutons, rice, flour, lentils, ginger","Combine croutons, rice, flour, lentils and ginger. Cook until done. Adjust seasoning to taste. Serve hot."
Sugar Delight,"sugar, caesar dressing, strawberries, pumpkin, lime, beans","Combine sugar, caesar dressing, strawberries, pumpkin, lime and beans. Cook until done. Adjust seasoning to taste. Serve hot."
Vegetables Delight,"vegetables, pepper",Combine vegetables and pepper. Cook until done. Adjust seasoning to taste. Serve hot.
Chicken Casserole,"chicken, pasta",Combine chicken and pasta. Cook until done. Adjust seasoning to taste. Serve hot.
Parmesan Bake,"parmesan, coconut milk",Combine parmesan and coconut milk. Cook until done. Adjust seasoning to taste. Serve hot.
Chicken Stir-Fry,"chicken, garlic, breadcrumbs, yogurt","Combine chicken, garlic, breadcrumbs and yogurt. Cook until done. Adjust seasoning to taste. Serve hot."
Bread Delight,"bread, mozzarella, yogurt, chickpeas","Combine bread, mozzarella, yogurt and chickpeas. Cook until done. Adjust seasoning to taste. Serve hot."
Vegetables Skillet,"vegetables, lemon, curry powder, parmesan, yogurt","Combine vegetables, lemon, curry powder, parmesan and yogurt. Cook until done. Adjust seasoning to taste. Serve hot."
Apples Casserole,"apples, croutons",Combine apples and croutons. Cook until done. Adjust seasoning to taste. Serve hot.
Caesar Dressing Salad,"caesar dressing, tomato sauce",Combine caesar dressing and tomato sauce. Cook until done. Adjust seasoning to taste. Serve hot.
Pasta Bake,"pasta, avocado, yogurt, lime, cabbage, parmesan","Combine pasta, avocado, yogurt, lime, cabbage and parmesan. Cook until done. Adjust seasoning to taste. Serve hot."
Blueberries Skillet,"blueberries, curry powder, mussels, breadcrumbs, bun","Combine blueberries, curry powder, mussels, breadcrumbs and bun. Cook until done. Adjust seasoning to taste. Serve hot."
Mozzarella Bake,"mozzarella, lamb, carrots, mushrooms","Combine mozzarella, lamb, carrots and mushrooms. Cook until done. Adjust seasoning to taste. Serve hot."
Bell Peppers Delight,"bell peppers, salsa, strawberries","Combine bell peppers, salsa and strawberries. Cook until done. Adjust seasoning to taste. Serve hot."
Yogurt Pasta,"yogurt, chickpeas, pasta, mayonnaise, croutons, cheese","Combine yogurt, chickpeas, pasta, mayonnaise, croutons and cheese. Cook until done. Adjust seasoning to taste. Serve hot."
Pasta Frittata,"pasta, croutons, breadcrumbs, broth, carrots, cabbage","Combine pasta, croutons, breadcrumbs, broth, carrots and cabbage. Cook until done. Adjust seasoning to taste. Serve hot."
Mayonnaise Soup,"mayonnaise, parmesan, lemons, carrots, eggplant","Combine mayonnaise, parmesan, lemons, carrots and eggplant. Cook until done. Adjust seasoning to taste. Serve hot."
Eggplant Frittata,"eggplant, soy sauce",Combine eggplant and soy sauce. Cook until done. Adjust seasoning to taste. Serve hot.
Tortilla Frittata,"tortilla, ginger, banana, lamb, cream, salmon","Combine tortilla, ginger, banana, lamb, cream and salmon. Cook until done. Adjust seasoning to taste. Serve hot."
Cocoa Powder Pasta,"cocoa powder, mustard, honey, beans, dill, rice","Combine cocoa powder, mustard, honey, beans, dill and rice. Cook until done. Adjust seasoning to taste. Serve hot."
Dill Frittata,"dill, rice",Combine dill and rice. Cook until done. Adjust seasoning to taste. Serve hot.
Salsa Stir-Fry,"salsa, avocado",Combine salsa and avocado. Cook until done. Adjust seasoning to taste. Serve hot.
Caesar Dressing Stir-Fry,"caesar dressing, mussels, strawberries, onions","Combine caesar dressing, mussels, strawberries and onions. Cook until done. Adjust seasoning to taste. Serve hot."
Chocolate Delight,"chocolate, pie crust, blueberries, balsamic, tomato sauce, bell peppers","Combine chocolate, pie crust, blueberries, balsamic, tomato sauce and bell peppers. Cook until done. Adjust seasoning to taste. Serve hot."
Croutons Tart,"croutons, basil, beef, mustard","Combine croutons, basil, beef and mustard. Cook until done. Adjust seasoning to taste. Serve hot."
Vegetables Pasta,"vegetables, rosemary, onions, parmesan","Combine vegetables, rosemary, onions and parmesan. Cook until done. Adjust seasoning to taste. Serve hot."
Vinegar Tart,"vinegar, salt",Combine vinegar and salt. Cook until done. Adjust seasoning to taste. Serve hot.
Cheese Salad,"cheese, garlic, bread, lemon, water, saffron","Combine cheese, garlic, bread, lemon, water and saffron. Cook until done. Adjust seasoning to taste. Serve hot."
Salt Frittata,"salt, lentils, mustard","Combine salt, lentils and mustard. Cook until done. Adjust seasoning to taste. Serve hot."
Lemon Salad,"lemon, parsley",Combine lemon and parsley. Cook until done. Adjust seasoning to taste. Serve hot.
Eggplant Pasta,"eggplant, breadcrumbs",Combine eggplant and breadcrumbs. Cook until done. Adjust seasoning to taste. Serve hot.
Pepper Frittata,"pepper, tortillas",Combine pepper and tortillas. Cook until done. Adjust seasoning to taste. Serve hot.
Lemon Bake,"lemon, zucchini",Combine lemon and zucchini. Cook until done. Adjust seasoning to taste. Serve hot.
Avocado Delight,"avocado, carrots",Combine avocado and carrots. Cook until done. Adjust seasoning to taste. Serve hot.
Rice Tart,"rice, mayonnaise, salmon","Combine rice, mayonnaise and salmon. Cook until done. Adjust seasoning to taste. Serve hot."
Chickpeas Skillet,"chickpeas, mozzarella, caesar dressing, flour","Combine chickpeas, mozzarella, caesar dressing and flour. Cook until done. Adjust seasoning to taste. Serve hot."
Lettuce Soup,"lettuce, parmesan",Combine lettuce and parmesan. Cook until done. Adjust seasoning to taste. Serve hot.
Bell Peppers Casserole,"bell peppers, fish, sugar, vegetables, blueberries, rice","Combine bell peppers, fish, sugar, vegetables, blueberries and rice. Cook until done. Adjust seasoning to taste. Serve hot."
Mixed Vegetables Bake,"mixed vegetables, beef, rice, strawberries, chickpeas, mozzarella","Combine mixed vegetables, beef, rice, strawberries, chickpeas and mozzarella. Cook until done. Adjust seasoning to taste. Serve hot."
Bun Tart,"bun, sugar, butter, curry powder","Combine bun, sugar, butter and curry powder. Cook until done. Adjust seasoning to taste. Serve hot."
Basil Salad,"basil, avocado",Combine basil and avocado. Cook until done. Adjust seasoning to taste. Serve hot.
Pie Crust Pasta,"pie crust, mixed vegetables",Combine pie crust and mixed vegetables. Cook until done. Adjust seasoning to taste. Serve hot.
Chocolate Pasta,"chocolate, bananas, soy sauce","Combine chocolate, bananas and soy sauce. Cook until done. Adjust seasoning to taste. Serve hot."
Lentils Stir-Fry,"lentils, eggplant, onions","Combine lentils, eggplant and onions. Cook until done. Adjust seasoning to taste. Serve hot."
Blueberries Tart,"blueberries, sugar, mozzarella, cabbage","Combine blueberries, sugar, mozzarella and cabbage. Cook until done. Adjust seasoning to taste. Serve hot."
Chocolate Tart,"chocolate, cucumber",Combine chocolate and cucumber. Cook until done. Adjust seasoning to taste. Serve hot.
Olive Oil Casserole,"olive oil, bell peppers",Combine olive oil and bell peppers. Cook until done. Adjust seasoning to taste. Serve hot.
Lemon Casserole,"lemon, lentils, breadcrumbs, soy sauce","Combine lemon, lentils, breadcrumbs and soy sauce. Cook until done. Adjust seasoning to taste. Serve hot."
Mozzarella Soup,"mozzarella, coconut milk",Combine mozzarella and coconut milk. Cook until done. Adjust seasoning to taste. Serve hot.
Lamb Casserole,"lamb, tuna, eggplant, peppers, mozzarella, tomato sauce","Combine lamb, tuna, eggplant, peppers, mozzarella and tomato sauce. Cook until done. Adjust seasoning to taste. Serve hot."
Shrimp Delight,"shrimp, eggplant, cheese","Combine shrimp, eggplant and cheese. Cook until done. Adjust seasoning to taste. Serve hot."
Banana Delight,"banana, curry powder, shrimp, mayonnaise, vinegar","Combine banana, curry powder, shrimp, mayonnaise and vinegar. Cook until done. Adjust seasoning to taste. Serve hot."
Apples Skillet,"apples, zucchini, mushrooms, lemon","Combine apples, zucchini, mushrooms and lemon. Cook until done. Adjust seasoning to taste. Serve hot."
Salsa Casserole,"salsa, dill, onions","Combine salsa, dill and onions. Cook until done. Adjust seasoning to taste. Serve hot."
Celery Skillet,"celery, garlic",Combine celery and garlic. Cook until done. Adjust seasoning to taste. Serve hot.
Curry Powder Pasta,"curry powder, salmon",Combine curry powder and salmon. Cook until done. Adjust seasoning to taste. Serve hot.
Pepper Tart,"pepper, bread, tomato, broth","Combine pepper, bread, tomato and broth. Cook until done. Adjust seasoning to taste. Serve hot."
Vinegar Frittata,"vinegar, mustard, blueberries","Combine vinegar, mustard and blueberries. Cook until done. Adjust seasoning to taste. Serve hot."
Beef Stir-Fry,"beef, parsley, caesar dressing, dill, honey, fish","Combine beef, parsley, caesar dressing, dill, honey and fish. Cook until done. Adjust seasoning to taste. Serve hot."
Lentils Skillet,"lentils, lemons, peas, flour, curry powder","Combine lentils, lemons, peas, flour and curry powder. Cook until done. Adjust seasoning to taste. Serve hot."
Carrots Bake,"carrots, tomato, bun","Combine carrots, tomato and bun. Cook until done. Adjust seasoning to taste. Serve hot."
Chickpeas Casserole,"chickpeas, peas",Combine chickpeas and peas. Cook until done. Adjust seasoning to taste. Serve hot.
Onion Salad,"onion, cabbage, salt, milk","Combine onion, cabbage, salt and milk. Cook until done. Adjust seasoning to taste. Serve hot."
Lemon Bake,"lemon, peppers, fish, cabbage, breadcrumbs","Combine lemon, peppers, fish, cabbage and breadcrumbs. Cook until done. Adjust seasoning to taste. Serve hot."
Tortilla Bake,"tortilla, basil, croutons, lentils","Combine tortilla, basil, croutons and lentils. Cook until done. Adjust seasoning to taste. Serve hot."
Eggplant Pasta,"eggplant, milk",Combine eggplant and milk. Cook until done. Adjust seasoning to taste. Serve hot.
Beans Casserole,"beans, lamb, fish, chocolate, banana, olive oil","Combine beans, lamb, fish, chocolate, banana and olive oil. Cook until done. Adjust seasoning to taste. Serve hot."
Soy Sauce Skillet,"soy sauce, eggplant, broth, peppers, bun, carrots","Combine soy sauce, eggplant, broth, peppers, bun and carrots. Cook until done. Adjust seasoning to taste. Serve hot."
Beef Bake,"beef, cucumber",Combine beef and cucumber. Cook until done. Adjust seasoning to taste. Serve hot.
Olive Oil Skillet,"olive oil, mozzarella, vegetables","Combine olive oil, mozzarella and vegetables. Cook until done. Adjust seasoning to taste. Serve hot."
Tomato Sauce Casserole,"tomato sauce, fish, blueberries, balsamic, bell peppers, coconut milk","Combine tomato sauce, fish, blueberries, balsamic, bell peppers and coconut milk. Cook until done. Adjust seasoning to taste. Serve hot."
Breadcrumbs Delight,"breadcrumbs, lettuce, cabbage","Combine breadcrumbs, lettuce and cabbage. Cook until done. Adjust seasoning to taste. Serve hot."
Beans Casserole,"beans, chickpeas, sugar, parsley, mustard","Combine beans, chickpeas, sugar, parsley and mustard. Cook until done. Adjust seasoning to taste. Serve hot."
Mushrooms Bake,"mushrooms, parmesan",Combine mushrooms and parmesan. Cook until done. Adjust seasoning to taste. Serve hot.
Croutons Bake,"croutons, cinnamon, garlic, peas","Combine croutons, cinnamon, garlic and peas. Cook until done. Adjust seasoning to taste. Serve hot."
Tortillas Frittata,"tortillas, tuna",Combine tortillas and tuna. Cook until done. Adjust seasoning to taste. Serve hot.
Water Pasta,"water, honey, rice","Combine water, honey and rice. Cook until done. Adjust seasoning to taste. Serve hot."
Potatoes Pasta,"potatoes, beef, breadcrumbs, garlic, mussels, carrots","Combine potatoes, beef, breadcrumbs, garlic, mussels and carrots. Cook until done. Adjust seasoning to taste. Serve hot."
Water Tart,"water, salsa, eggplant","Combine water, salsa and eggplant. Cook until done. Adjust seasoning to taste. Serve hot."
Mushrooms Casserole,"mushrooms, milk",Combine mushrooms and milk. Cook until done. Adjust seasoning to taste. Serve hot.
Pumpkin Soup,"pumpkin, mayonnaise, strawberries, rosemary, lentils, mussels","Combine pumpkin, mayonnaise, strawberries, rosemary, lentils and mussels. Cook until done. Adjust seasoning to taste. Serve hot."
Banana Salad,"banana, lemons, tomatoes","Combine banana, lemons and tomatoes. Cook until done. Adjust seasoning to taste. Serve hot."
Garlic Casserole,"garlic, beef",Combine garlic and beef. Cook until done. Adjust seasoning to taste. Serve hot.
Milk Salad,"milk, tomato, curry powder, chicken, broth, eggplant","Combine milk, tomato, curry powder, chicken, broth and eggplant. Cook until done. Adjust seasoning to taste. Serve hot."
Salt Pasta,"salt, beef, cucumber, sugar","Combine salt, beef, cucumber and sugar. Cook until done. Adjust seasoning to taste. Serve hot."
