RecipeName,Ingredients,Instructions
Chocolate Stir-Fry,"chocolate, dill, tomato sauce, lemons","Combine chocolate, dill, tomato sauce and lemons. Cook until done. Adjust seasoning to taste. Serve hot."
Banana Salad,"banana, milk, strawberries, water, celery, vinegar","Combine banana, milk, strawberries, water, celery and vinegar. Cook until done. Adjust seasoning to taste. Serve hot."
Shrimp Skillet,"shrimp, lemon, chocolate, pumpkin, bananas","Combine shrimp, lemon, chocolate, pumpkin and bananas. Cook until done. Adjust seasoning to taste. Serve hot."
Curry Powder Salad,"curry powder, tortilla",Combine curry powder and tortilla. Cook until done. Adjust seasoning to taste. Serve hot.
Salsa Delight,"salsa, potatoes",Combine salsa and potatoes. Cook until done. Adjust seasoning to taste. Serve hot.
Tortillas Bake,"tortillas, coconut milk, caesar dressing, lime","Combine tortillas, coconut milk, caesar dressing and lime. Cook until done. Adjust seasoning to taste. Serve hot."
Beef Bake,"beef, balsamic, celery, tomato sauce","Combine beef, balsamic, celery and tomato sauce. Cook until done. Adjust seasoning to taste. Serve hot."
Salsa Skillet,"salsa, mixed vegetables",Combine salsa and mixed vegetables. Cook until done. Adjust seasoning to taste. Serve hot.
Zucchini Stir-Fry,"zucchini, mustard, tomato sauce, broth","Combine zucchini, mustard, tomato sauce and broth. Cook until done. Adjust seasoning to taste. Serve hot."
Lentils Casserole,"lentils, carrots, chicken, parsley","Combine lentils, carrots, chicken and parsley. Cook until done. Adjust seasoning to taste. Serve hot."
Chocolate Salad,"chocolate, spinach, tortillas, milk","Combine chocolate, spinach, tortillas and milk. Cook until done. Adjust seasoning to taste. Serve hot."
Chocolate Delight,"chocolate, mushrooms, lemon, honey, caesar dressing, zucchini","Combine chocolate, mushrooms, lemon, honey, caesar dressing and zucchini. Cook until done. Adjust seasoning to taste. Serve hot."
Mustard Frittata,"mustard, strawberries, bananas, cinnamon, tortilla, lemons","Combine mustard, strawberries, bananas, cinnamon, tortilla and lemons. Cook until done. Adjust seasoning to taste. Serve hot."
Vinegar Casserole,"vinegar, strawberries, bun","Combine vinegar, strawberries and bun. Cook until done. Adjust seasoning to taste. Serve hot."
Lettuce Stir-Fry,"lettuce, blueberries, dill","Combine lettuce, blueberries and dill. Cook until done. Adjust seasoning to taste. Serve hot."
Chickpeas Casserole,"chickpeas, vinegar, breadcrumbs, lettuce","Combine chickpeas, vinegar, breadcrumbs and lettuce. Cook until done. Adjust seasoning to taste. Serve hot."
Fish Salad,"fish, cream",Combine fish and cream. Cook until done. Adjust seasoning to taste. Serve hot.
Mayonnaise Skillet,"mayonnaise, eggs",Combine mayonnaise and eggs. Cook until done. Adjust seasoning to taste. Serve hot.
Beans Casserole,"beans, mussels",Combine beans and mussels. Cook until done. Adjust seasoning to taste. Serve hot.
Chickpeas Tart,"chickpeas, onion, rice, mushrooms, mayonnaise","Combine chickpeas, onion, rice, mushrooms and mayonnaise. Cook until done. Adjust seasoning to taste. Serve hot."
Broth Bake,"broth, potatoes, sugar, yogurt, cucumber","Combine broth, potatoes, sugar, yogurt and cucumber. Cook until done. Adjust seasoning to taste. Serve hot."
Blueberries Soup,"blueberries, bananas, honey, balsamic, lemons","Combine blueberries, bananas, honey, balsamic and lemons. Cook until done. Adjust seasoning to taste. Serve hot."
Blueberries Bake,"blueberries, lime",Combine blueberries and lime. Cook until done. Adjust seasoning to taste. Serve hot.
Chicken Frittata,"chicken, blueberries, soy sauce, breadcrumbs, lime","Combine chicken, blueberries, soy sauce, breadcrumbs and lime. Cook until done. Adjust seasoning to taste. Serve hot."
Potatoes Bake,"potatoes, banana, parsley, chickpeas, tortilla, water","Combine potatoes, banana, parsley, chickpeas, tortilla and water. Cook until done. Adjust seasoning to taste. Serve hot."
Broth Salad,"broth, lettuce",Combine broth and lettuce. Cook until done. Adjust seasoning to taste. Serve hot.
Onion Soup,"onion, soy sauce, shrimp","Combine onion, soy sauce and shrimp. Cook until done. Adjust seasoning to taste. Serve hot."
Lamb Pasta,"lamb, dill, broth, beans","Combine lamb, dill, broth and beans. Cook until done. Adjust seasoning to taste. Serve hot."
Soy Sauce Pasta,"soy sauce, pumpkin, cheese, beans, mixed vegetables, apples","Combine soy sauce, pumpkin, cheese, beans, mixed vegetables and apples. Cook until done. Adjust seasoning to taste. Serve hot."
Honey Frittata,"honey, zucchini",Combine honey and zucchini. Cook until done. Adjust seasoning to taste. Serve hot.
Coconut Milk Soup,"coconut milk, broth, banana, cream, chickpeas","Combine coconut milk, broth, banana, cream and chickpeas. Cook until done. Adjust seasoning to taste. Serve hot."
Pie Crust Soup,"pie crust, butter",Combine pie crust and butter. Cook until done. Adjust seasoning to taste. Serve hot.
Pie Crust Tart,"pie crust, pumpkin, zucchini, fish, breadcrumbs","Combine pie crust, pumpkin, zucchini, fish and breadcrumbs. Cook until done. Adjust seasoning to taste. Serve hot."
Cinnamon Soup,"cinnamon, mozzarella, mushrooms, peas, basil","Combine cinnamon, mozzarella, mushrooms, peas and basil. Cook until done. Adjust seasoning to taste. Serve hot."
Peppers Delight,"peppers, fish, cucumber, flour, strawberries","Combine peppers, fish, cucumber, flour and strawberries. Cook until done. Adjust seasoning to taste. Serve hot."
Broth Tart,"broth, bread, mayonnaise","Combine broth, bread and mayonnaise. Cook until done. Adjust seasoning to taste. Serve hot."
Tomato Sauce Tart,"tomato sauce, curry powder, soy sauce, beef, mussels","Combine tomato sauce, curry powder, soy sauce, beef and mussels. Cook until done. Adjust seasoning to taste. Serve hot."
Salt Skillet,"salt, pie crust, sugar, dill, lamb","Combine salt, pie crust, sugar, dill and lamb. Cook until done. Adjust seasoning to taste. Serve hot."
Bananas Bake,"bananas, rosemary, sugar, salmon, tuna","Combine bananas, rosemary, sugar, salmon and tuna. Cook until done. Adjust seasoning to taste. Serve hot."
Peas Bake,"peas, chocolate",Combine peas and chocolate. Cook until done. Adjust seasoning to taste. Serve hot.
Cocoa Powder Pasta,"cocoa powder, caesar dressing, basil","Combine cocoa powder, caesar dressing and basil. Cook until done. Adjust seasoning to taste. Serve hot."
Parsley Bake,"parsley, coconut milk",Combine parsley and coconut milk. Cook until done. Adjust seasoning to taste. Serve hot.
Fish Pasta,"fish, lemons, bell peppers, breadcrumbs, mussels, spinach","Combine fish, lemons, bell peppers, breadcrumbs, mussels and spinach. Cook until done. Adjust seasoning to taste. Serve hot."
Lentils Frittata,"lentils, garlic, salmon, pepper, avocado, tuna","Combine lentils, garlic, salmon, pepper, avocado and tuna. Cook until done. Adjust seasoning to taste. Serve hot."
Onions Frittata,"onions, butter, zucchini, cheese, celery, strawberries","Combine onions, butter, zucchini, cheese, celery and strawberries. Cook until done. Adjust seasoning to taste. Serve hot."
Broth Stir-Fry,"broth, bun, strawberries, zucchini, ginger, salt","Combine broth, bun, strawberries, zucchini, ginger and salt. Cook until done. Adjust seasoning to taste. Serve hot."
Fish Frittata,"fish, mussels, yogurt, pumpkin, sugar","Combine fish, mussels, yogurt, pumpkin and sugar. Cook until done. Adjust seasoning to taste. Serve hot."
Bananas Frittata,"bananas, chocolate, garlic, olive oil, celery","Combine bananas, chocolate, garlic, olive oil and celery. Cook until done. Adjust seasoning to taste. Serve hot."
Olive Oil Casserole,"olive oil, bananas, mustard, lettuce, dill, beans","Combine olive oil, bananas, mustard, lettuce, dill and beans. Cook until done. Adjust seasoning to taste. Serve hot."
Mozzarella Soup,"mozzarella, balsamic, lime, lamb","Combine mozzarella, balsamic, lime and lamb. Cook until done. Adjust seasoning to taste. Serve hot."
Pumpkin Soup,"pumpkin, broth, curry powder, carrots","Combine pumpkin, broth, curry powder and carrots. Cook until done. Adjust seasoning to taste. Serve hot."
Lentils Skillet,"lentils, flour, onions, tortilla, water","Combine lentils, flour, onions, tortilla and water. Cook until done. Adjust seasoning to taste. Serve hot."
Pasta Casserole,"pasta, croutons, onion","Combine pasta, croutons and onion. Cook until done. Adjust seasoning to taste. Serve hot."
Mozzarella Tart,"mozzarella, beef, saffron, chicken, bell peppers, lemon","Combine mozzarella, beef, saffron, chicken, bell peppers and lemon. Cook until done. Adjust seasoning to taste. Serve hot."
Carrots Salad,"carrots, salsa, strawberries, banana, chocolate","Combine carrots, salsa, strawberries, banana and chocolate. Cook until done. Adjust seasoning to taste. Serve hot."
Beef Casserole,"beef, eggplant, bananas","Combine beef, eggplant and bananas. Cook until done. Adjust seasoning to taste. Serve hot."
Mixed Vegetables Soup,"mixed vegetables, coconut milk",Combine mixed vegetables and coconut milk. Cook until done. Adjust seasoning to taste. Serve hot.
Peppers Skillet,"peppers, rosemary, mustard, vinegar","Combine peppers, rosemary, mustard and vinegar. Cook until done. Adjust seasoning to taste. Serve hot."
Dill Casserole,"dill, mozzarella",Combine dill and mozzarella. Cook until done. Adjust seasoning to taste. Serve hot.
Peas Stir-Fry,"peas, chocolate, pie crust, tomato sauce, soy sauce, mayonnaise","Combine peas, chocolate, pie crust, tomato sauce, soy sauce and mayonnaise. Cook until done. Adjust seasoning to taste. Serve hot."
Fish Delight,"fish, breadcrumbs, ginger","Combine fish, breadcrumbs and ginger. Cook until done. Adjust seasoning to taste. Serve hot."
Beans Salad,"beans, chicken, sugar, croutons, cucumber","Combine beans, chicken, sugar, croutons and cucumber. Cook until done. Adjust seasoning to taste. Serve hot."
Flour Tart,"flour, yogurt, onion","Combine flour, yogurt and onion. Cook until done. Adjust seasoning to taste. Serve hot."
Avocado Bake,"avocado, pie crust",Combine avocado and pie crust. Cook until done. Adjust seasoning to taste. Serve hot.
Tomatoes Soup,"tomatoes, avocado, cucumber","Combine tomatoes, avocado and cucumber. Cook until done. Adjust seasoning to taste. Serve hot."
Lemon Casserole,"lemon, water, garlic, parmesan, mushrooms, mayonnaise","Combine lemon, water, garlic, parmesan, mushrooms and mayonnaise. Cook until done. Adjust seasoning to taste. Serve hot."
Croutons Frittata,"croutons, peppers, lamb, salmon","Combine croutons, peppers, lamb and salmon. Cook until done. Adjust seasoning to taste. Serve hot."
Tomato Stir-Fry,"tomato, bun, apples, saffron, zucchini","Combine tomato, bun, apples, saffron and zucchini. Cook until done. Adjust seasoning to taste. Serve hot."
Water Casserole,"water, tomatoes, tortilla, ginger, lamb, bun","Combine water, tomatoes, tortilla, ginger, lamb and bun. Cook until done. Adjust seasoning to taste. Serve hot."
Lime Stir-Fry,"lime, garlic",Combine lime and garlic. Cook until done. Adjust seasoning to taste. Serve hot.
Fish Bake,"fish, yogurt, lamb, cocoa powder","Combine fish, yogurt, lamb and cocoa powder. Cook until done. Adjust seasoning to taste. Serve hot."
Dill Delight,"dill, beef, tomatoes, olive oil, lemons, carrots","Combine dill, beef, tomatoes, olive oil, lemons and carrots. Cook until done. Adjust seasoning to taste. Serve hot."
Honey Delight,"honey, fish, onions, olive oil, mussels","Combine honey, fish, onions, olive oil and mussels. Cook until done. Adjust seasoning to taste. Serve hot."
Sugar Stir-Fry,"sugar, cocoa powder, lime, cucumber, salt, pie crust","Combine sugar, cocoa powder, lime, cucumber, salt and pie crust. Cook until done. Adjust seasoning to taste. Serve hot."
Lamb Casserole,"lamb, chickpeas, spinach, cinnamon, honey, broth","Combine lamb, chickpeas, spinach, cinnamon, honey and broth. Cook until done. Adjust seasoning to taste. Serve hot."
Fish Stir-Fry,"fish, spinach, cinnamon","Combine fish, spinach and cinnamon. Cook until done. Adjust seasoning to taste. Serve hot."
Cucumber Salad,"cucumber, milk",Combine cucumber and milk. Cook until done. Adjust seasoning to taste. Serve hot.
Onions Frittata,"onions, lettuce, mozzarella, fish","Combine onions, lettuce, mozzarella and fish. Cook until done. Adjust seasoning to taste. Serve hot."
Peppers Frittata,"peppers, cabbage, pie crust, beans","Combine peppers, cabbage, pie crust and beans. Cook until done. Adjust seasoning to taste. Serve hot."
Tuna Pasta,"tuna, blueberries, pie crust, cocoa powder, rosemary, cabbage","Combine tuna, blueberries, pie crust, cocoa powder, rosemary and cabbage. Cook until done. Adjust seasoning to taste. Serve hot."
Lamb Stir-Fry,"lamb, onion, beans, cheese, carrots, coconut milk","Combine lamb, onion, beans, cheese, carrots and coconut milk. Cook until done. Adjust seasoning to taste. Serve hot."
Strawberries Skillet,"strawberries, pepper, celery, lemons, cinnamon","Combine strawberries, pepper, celery, lemons and cinnamon. Cook until done. Adjust seasoning to taste. Serve hot."
Lettuce Delight,"lettuce, vegetables, chocolate, lemons, vinegar","Combine lettuce, vegetables, chocolate, lemons and vinegar. Cook until done. Adjust seasoning to taste. Serve hot."
Peas Salad,"peas, garlic",Combine peas and garlic. Cook until done. Adjust seasoning to taste. Serve hot.
Sugar Skillet,"sugar, chicken, pumpkin","Combine sugar, chicken and pumpkin. Cook until done. Adjust seasoning to taste. Serve hot."
Tortillas Pasta,"tortillas, parsley, vinegar","Combine tortillas, parsley and vinegar. Cook until done. Adjust seasoning to taste. Serve hot."
Parmesan Tart,"parmesan, potatoes, mussels, apples, bananas","Combine parmesan, potatoes, mussels, apples and bananas. Cook until done. Adjust seasoning to taste. Serve hot."
Mozzarella Tart,"mozzarella, avocado, lentils","Combine mozzarella, avocado and lentils. Cook until done. Adjust seasoning to taste. Serve hot."
Balsamic Salad,"balsamic, apples, vegetables","Combine balsamic, apples and vegetables. Cook until done. Adjust seasoning to taste. Serve hot."
Mayonnaise Skillet,"mayonnaise, lemon, caesar dressing","Combine mayonnaise, lemon and caesar dressing. Cook until done. Adjust seasoning to taste. Serve hot."
Rosemary Delight,"rosemary, tomato sauce, lemon, chickpeas, bell peppers","Combine rosemary, tomato sauce, lemon, chickpeas and bell peppers. Cook until done. Adjust seasoning to taste. Serve hot."
Honey Tart,"honey, pepper, salmon, tomatoes","Combine honey, pepper, salmon and tomatoes. Cook until done. Adjust seasoning to taste. Serve hot."
Parsley Stir-Fry,"parsley, carrots, lime, pumpkin","Combine parsley, carrots, lime and pumpkin. Cook until done. Adjust seasoning to taste. Serve hot."
Chickpeas Salad,"chickpeas, olive oil, balsamic","Combine chickpeas, olive oil and balsamic. Cook until done. Adjust seasoning to taste. Serve hot."
Caesar Dressing Frittata,"caesar dressing, croutons, balsamic","Combine caesar dressing, croutons and balsamic. Cook until done. Adjust seasoning to taste. Serve hot."
Chickpeas Tart,"chickpeas, cabbage, mixed vegetables, bananas, mushrooms, eggs","Combine chickpeas, cabbage, mixed vegetables, bananas, mushrooms and eggs. Cook until done. Adjust seasoning to taste. Serve hot."
Beans Skillet,"beans, tomatoes, zucchini, bun, balsamic, water","Combine beans, tomatoes, zucchini, bun, balsamic and water. Cook until done. Adjust seasoning to taste. Serve hot."
Pasta Casserole,"pasta, mushrooms, cabbage, soy sauce, eggs","Combine pasta, mushrooms, cabbage, soy sauce and eggs. Cook until done. Adjust seasoning to taste. Serve hot."
Cream Soup,"cream, vegetables, avocado","Combine cream, vegetables and avocado. Cook until done. Adjust seasoning to taste. Serve hot."
Zucchini Frittata,"zucchini, broth, salmon, flour, tuna","Combine zucchini, broth, salmon, flour and tuna. Cook until done. Adjust seasoning to taste. Serve hot."
Onions Frittata,"onions, bun, saffron","Combine onions, bun and saffron. Cook until done. Adjust seasoning to taste. Serve hot."
Ginger Skillet,"ginger, butter",Combine ginger and butter. Cook until done. Adjust seasoning to taste. Serve hot.
Coconut Milk Pasta,"coconut milk, tortilla, fish, salmon, milk","Combine coconut milk, tortilla, fish, salmon and milk. Cook until done. Adjust seasoning to taste. Serve hot."
Chicken Salad,"chicken, basil, soy sauce, rice","Combine chicken, basil, soy sauce and rice. Cook until done. Adjust seasoning to taste. Serve hot."
Lettuce Skillet,"lettuce, dill, apples, avocado, breadcrumbs","Combine lettuce, dill, apples, avocado and breadcrumbs. Cook until done. Adjust seasoning to taste. Serve hot."
Rice Soup,"rice, cheese, breadcrumbs, saffron, blueberries, broth","Combine rice, cheese, breadcrumbs, saffron, blueberries and broth. Cook until done. Adjust seasoning to taste. Serve hot."
Pepper Casserole,"pepper, honey, fish","Combine pepper, honey and fish. Cook until done. Adjust seasoning to taste. Serve hot."
Broth Delight,"broth, chocolate",Combine broth and chocolate. Cook until done. Adjust seasoning to taste. Serve hot.
Mixed Vegetables Skillet,"mixed vegetables, lemons, parmesan, butter","Combine mixed vegetables, lemons, parmesan and butter. Cook until done. Adjust seasoning to taste. Serve hot."
Avocado Bake,"avocado, carrots",Combine avocado and carrots. Cook until done. Adjust seasoning to taste. Serve hot.
Milk Skillet,"milk, pasta, tuna, flour","Combine milk, pasta, tuna and flour. Cook until done. Adjust seasoning to taste. Serve hot."
Lime Pasta,"lime, cinnamon, butter, olive oil","Combine lime, cinnamon, butter and olive oil. Cook until done. Adjust seasoning to taste. Serve hot."
Flour Bake,"flour, mussels, potatoes, onions, yogurt","Combine flour, mussels, potatoes, onions and yogurt. Cook until done. Adjust seasoning to taste. Serve hot."
Caesar Dressing Bake,"caesar dressing, beef",Combine caesar dressing and beef. Cook until done. Adjust seasoning to taste. Serve hot.
Onions Casserole,"onions, tomato sauce",Combine onions and tomato sauce. Cook until done. Adjust seasoning to taste. Serve hot.
Pasta Delight,"pasta, cinnamon, tortillas, mushrooms, milk, water","Combine pasta, cinnamon, tortillas, mushrooms, milk and water. Cook until done. Adjust seasoning to taste. Serve hot."
Potatoes Pasta,"potatoes, pumpkin, butter","Combine potatoes, pumpkin and butter. Cook until done. Adjust seasoning to taste. Serve hot."
Basil Delight,"basil, bell peppers, fish, yogurt, lemons","Combine basil, bell peppers, fish, yogurt and lemons. Cook until done. Adjust seasoning to taste. Serve hot."
Sugar Frittata,"sugar, strawberries, cucumber, lime, salmon, vegetables","Combine sugar, strawberries, cucumber, lime, salmon and vegetables. Cook until done. Adjust seasoning to taste. Serve hot."
Parsley Salad,"parsley, zucchini",Combine parsley and zucchini. Cook until done. Adjust seasoning to taste. Serve hot.
Mayonnaise Tart,"mayonnaise, zucchini, water, mussels, cheese","Combine mayonnaise, zucchini, water, mussels and cheese. Cook until done. Adjust seasoning to taste. Serve hot."
Beans Casserole,"beans, avocado, water, chicken, rosemary, pie crust","Combine beans, avocado, water, chicken, rosemary and pie crust. Cook until done. Adjust seasoning to taste. Serve hot."
Blueberries Salad,"blueberries, pumpkin, lentils","Combine blueberries, pumpkin and lentils. Cook until done. Adjust seasoning to taste. Serve hot."
Garlic Tart,"garlic, beans, rosemary, cucumber","Combine garlic, beans, rosemary and cucumber. Cook until done. Adjust seasoning to taste. Serve hot."
Olive Oil Frittata,"olive oil, dill, bread, pepper, pasta","Combine olive oil, dill, bread, pepper and pasta. Cook until done. Adjust seasoning to taste. Serve hot."
Breadcrumbs Casserole,"breadcrumbs, rice, peas, lemons, cabbage","Combine breadcrumbs, rice, peas, lemons and cabbage. Cook until done. Adjust seasoning to taste. Serve hot."
Bun Pasta,"bun, olive oil",Combine bun and olive oil. Cook until done. Adjust seasoning to taste. Serve hot.
Spinach Delight,"spinach, soy sauce",Combine spinach and soy sauce. Cook until done. Adjust seasoning to taste. Serve hot.
Tortilla Soup,"tortilla, tuna",Combine tortilla and tuna. Cook until done. Adjust seasoning to taste. Serve hot.
Spinach Salad,"spinach, cream, pepper, lime, mixed vegetables, beans","Combine spinach, cream, pepper, lime, mixed vegetables and beans. Cook until done. Adjust seasoning to taste. Serve hot."
Lettuce Stir-Fry,"lettuce, spinach, tuna, tomatoes, pie crust","Combine lettuce, spinach, tuna, tomatoes and pie crust. Cook until done. Adjust seasoning to taste. Serve hot."
Butter Stir-Fry,"butter, broth, zucchini, cucumber, apples","Combine butter, broth, zucchini, cucumber and apples. Cook until done. Adjust seasoning to taste. Serve hot."
Vinegar Stir-Fry,"vinegar, honey, soy sauce, salmon","Combine vinegar, honey, soy sauce and salmon. Cook until done. Adjust seasoning to taste. Serve hot."
Basil Casserole,"basil, chickpeas",Combine basil and chickpeas. Cook until done. Adjust seasoning to taste. Serve hot.
Onion Frittata,"onion, bun, eggs","Combine onion, bun and eggs. Cook until done. Adjust seasoning to taste. Serve hot."
Cocoa Powder Salad,"cocoa powder, cabbage, mustard","Combine cocoa powder, cabbage and mustard. Cook until done. Adjust seasoning to taste. Serve hot."
Cocoa Powder Frittata,"cocoa powder, lime, bun, onions, basil","Combine cocoa powder, lime, bun, onions and basil. Cook until done. Adjust seasoning to taste. Serve hot."
Peas Frittata,"peas, pepper",Combine peas and pepper. Cook until done. Adjust seasoning to taste. Serve hot.
Carrots Pasta,"carrots, rice, apples, salsa, beans, soy sauce","Combine carrots, rice, apples, salsa, beans and soy sauce. Cook until done. Adjust seasoning to taste. Serve hot."
Potatoes Skillet,"potatoes, saffron, chocolate, tomato, water, caesar dressing","Combine potatoes, saffron, chocolate, tomato, water and caesar dressing. Cook until done. Adjust seasoning to taste. Serve hot."
Zucchini Pasta,"zucchini, tomatoes, tortilla, lentils, rosemary","Combine zucchini, tomatoes, tortilla, lentils and rosemary. Cook until done. Adjust seasoning to taste. Serve hot."
Tortilla Soup,"tortilla, eggplant, garlic, mustard, lime","Combine tortilla, eggplant, garlic, mustard and lime. Cook until done. Adjust seasoning to taste. Serve hot."
Carrots Tart,"carrots, onion, tortilla, saffron, lamb","Combine carrots, onion, tortilla, saffron and lamb. Cook until done. Adjust seasoning to taste. Serve hot."
Soy Sauce Salad,"soy sauce, vegetables, croutons, coconut milk","Combine soy sauce, vegetables, croutons and coconut milk. Cook until done. Adjust seasoning to taste. Serve hot."
Honey Stir-Fry,"honey, mayonnaise, caesar dressing, chocolate, rosemary, shrimp","Combine honey, mayonnaise, caesar dressing, chocolate, rosemary and shrimp. Cook until done. Adjust seasoning to taste. Serve hot."
Milk Casserole,"milk, spinach",Combine milk and spinach. Cook until done. Adjust seasoning to taste. Serve hot.
Sugar Tart,"sugar, onions, salt, ginger, parmesan, avocado","Combine sugar, onions, salt, ginger, parmesan and avocado. Cook until done. Adjust seasoning to taste. Serve hot."
Banana Bake,"banana, mushrooms",Combine banana and mushrooms. Cook until done. Adjust seasoning to taste. Serve hot.
Beef Soup,"beef, coconut milk",Combine beef and coconut milk. Cook until done. Adjust seasoning to taste. Serve hot.
Ginger Delight,"ginger, eggs, celery","Combine ginger, eggs and celery. Cook until done. Adjust seasoning to taste. Serve hot."
Cream Casserole,"cream, shrimp, bananas, milk","Combine cream, shrimp, bananas and milk. Cook until done. Adjust seasoning to taste. Serve hot."
Tortillas Salad,"tortillas, spinach",Combine tortillas and spinach. Cook until done. Adjust seasoning to taste. Serve hot.
Mussels Pasta,"mussels, dill, saffron, ginger, beans, mushrooms","Combine mussels, dill, saffron, ginger, beans and mushrooms. Cook until done. Adjust seasoning to taste. Serve hot."
Lemons Salad,"lemons, soy sauce, beans, avocado, eggs","Combine lemons, soy sauce, beans, avocado and eggs. Cook until done. Adjust seasoning to taste. Serve hot."
Pasta Frittata,"pasta, cucumber, vinegar, mozzarella, tomato sauce, shrimp","Combine pasta, cucumber, vinegar, mozzarella, tomato sauce and shrimp. Cook until done. Adjust seasoning to taste. Serve hot."
Cocoa Powder Bake,"cocoa powder, honey, peas","Combine cocoa powder, honey and peas. Cook until done. Adjust seasoning to taste. Serve hot."
Cinnamon Tart,"cinnamon, chocolate",Combine cinnamon and chocolate. Cook until done. Adjust seasoning to taste. Serve hot.
Mushrooms Pasta,"mushrooms, basil",Combine mushrooms and basil. Cook until done. Adjust seasoning to taste. Serve hot.
Spinach Frittata,"spinach, fish, caesar dressing, chicken","Combine spinach, fish, caesar dressing and chicken. Cook until done. Adjust seasoning to taste. Serve hot."
Apples Delight,"apples, lettuce, peppers, cheese","Combine apples, lettuce, peppers and cheese. Cook until done. Adjust seasoning to taste. Serve hot."
Lentils Frittata,"lentils, tomatoes, beans","Combine lentils, tomatoes and beans. Cook until done. Adjust seasoning to taste. Serve hot."
Pumpkin Skillet,"pumpkin, sugar, soy sauce, milk","Combine pumpkin, sugar, soy sauce and milk. Cook until done. Adjust seasoning to taste. Serve hot."
Salsa Skillet,"salsa, cucumber, cinnamon, salmon","Combine salsa, cucumber, cinnamon and salmon. Cook until done. Adjust seasoning to taste. Serve hot."
Chicken Stir-Fry,"chicken, onions, shrimp, salt, olive oil, breadcrumbs","Combine chicken, onions, shrimp, salt, olive oil and breadcrumbs. Cook until done. Adjust seasoning to taste. Serve hot."
Croutons Stir-Fry,"croutons, zucchini, lettuce","Combine croutons, zucchini and lettuce. Cook until done. Adjust seasoning to taste. Serve hot."
