RecipeName,Ingredients,Instructions
Pancakes,"flour, eggs, milk, sugar",Mix all ingredients and fry on a pan.
Omelette,"eggs, milk, cheese","Whisk eggs and milk, cook in a pan with cheese."
Pasta,"pasta, tomatoes, garlic, olive oil","Cook pasta, make sauce with tomatoes and garlic."
Garlic Bread,"bread, garlic, butter",Spread garlic butter on bread and bake.
Salad,"lettuce, tomatoes, cucumber, olive oil",Chop vegetables and mix with olive oil.
Fried Rice,"rice, eggs, peas, soy sauce","Stir-fry rice with eggs and peas, add soy sauce."
Tacos,"tortillas, beef, cheese, lettuce, salsa","Fill tortillas with beef, cheese, and toppings."
Smoothie,"banana, yogurt, honey, milk",Blend all ingredients until smooth.
Chocolate Cake,"flour, sugar, cocoa powder, eggs, butter",Mix ingredients and bake in the oven.
Chicken Curry,"chicken, curry powder, coconut milk, rice","Cook chicken with curry powder and coconut milk, serve with rice."
Vegetable Stir Fry,"mixed vegetables, soy sauce, garlic",Stir-fry vegetables with garlic and soy sauce.
Quiche,"eggs, cream, cheese, pie crust","Mix eggs and cream, pour into crust, bake until set."
Minestrone Soup,"vegetables, pasta, beans, broth",Simmer vegetables and pasta in broth until cooked.
Grilled Cheese,"bread, cheese, butter","Butter bread, place cheese in between, grill until golden."
Tomato Soup,"tomatoes, garlic, onion, broth","Blend tomatoes, garlic, and onion; simmer in broth."
Banana Bread,"flour, sugar, bananas, eggs, butter","Mash bananas, mix with other ingredients, bake until golden."
Scrambled Eggs,"eggs, milk, butter, salt","Whisk eggs and milk, cook with butter, season with salt."
Beef Stew,"beef, potatoes, carrots, onion, broth",Simmer beef with vegetables and broth until tender.
Mac and Cheese,"pasta, cheese, milk, butter",Cook pasta and mix with melted cheese and milk.
Chicken Soup,"chicken, carrots, celery, broth",Simmer chicken and vegetables in broth until cooked.
Cheeseburger,"beef, bun, cheese, lettuce, tomato","Grill beef patty, place on bun with cheese and toppings."
Cabbage Salad,"cabbage, carrots, mayonnaise, vinegar","Chop cabbage and carrots, mix with dressing."
Lemonade,"lemons, sugar, water","Mix lemon juice, sugar, and water."
Fish Tacos,"fish, tortillas, cabbage, salsa, lime","Grill fish, fill tortillas with fish, cabbage, and salsa."
Avocado Toast,"bread, avocado, salt, pepper","Spread mashed avocado on toasted bread, season."
Vegetable Soup,"carrots, potatoes, celery, broth, onion",Simmer vegetables in broth until tender.
Chicken Salad,"chicken, lettuce, tomatoes, cucumber, mayonnaise",Mix chicken with vegetables and dressing.
Bruschetta,"bread, tomatoes, garlic, olive oil","Top toasted bread with tomatoes, garlic, and olive oil."
Spaghetti Bolognese,"pasta, beef, tomatoes, garlic, onion",Cook pasta and beef with tomato sauce.
Egg Salad,"eggs, mayonnaise, mustard, salt, pepper",Mix chopped eggs with mayonnaise and seasonings.
Tuna Sandwich,"bread, tuna, mayonnaise, lettuce",Fill bread with tuna mixed with mayonnaise and lettuce.
Apple Pie,"apples, sugar, flour, butter, cinnamon","Fill pie crust with apples, sugar, and cinnamon; bake."
Chicken Parmesan,"chicken, breadcrumbs, cheese, tomato sauce, pasta","Bread chicken, bake with tomato sauce and cheese."
Curry Lentils,"lentils, curry powder, coconut milk, tomatoes",Simmer lentils with curry powder and coconut milk.
Vegetable Curry,"potatoes, carrots, peas, curry powder, coconut milk",Cook vegetables in curry sauce with coconut milk.
Shrimp Stir Fry,"shrimp, mixed vegetables, soy sauce, garlic",Stir-fry shrimp and vegetables with soy sauce.
Baked Salmon,"salmon, lemon, garlic, olive oil, dill","Bake salmon with lemon, garlic, and dill."
Caesar Salad,"lettuce, croutons, parmesan, Caesar dressing","Mix lettuce with dressing, top with croutons and parmesan."
Zucchini Bread,"zucchini, flour, sugar, eggs, butter","Mix grated zucchini with ingredients, bake until golden."
Carrot Soup,"carrots, onion, ginger, broth, cream",Simmer carrots and blend with broth and cream.
Pumpkin Pie,"pumpkin, sugar, eggs, cream, cinnamon","Fill crust with pumpkin mixture, bake until set."
Beef Tacos,"beef, tortillas, lettuce, cheese, salsa","Cook beef, fill tortillas with toppings."
Coleslaw,"cabbage, carrots, mayonnaise, vinegar, sugar",Mix cabbage and carrots with dressing.
Falafel Wrap,"chickpeas, garlic, onion, parsley, tortillas","Bake falafel balls, serve in tortillas with vegetables."
Lamb Curry,"lamb, curry powder, tomatoes, coconut milk",Simmer lamb in curry sauce until tender.
Vegetable Lasagna,"pasta, cheese, spinach, tomatoes, zucchini","Layer pasta with vegetables and cheese, bake."
Berry Smoothie,"strawberries, blueberries, yogurt, honey, milk",Blend all ingredients until smooth.
Chocolate Brownies,"chocolate, butter, sugar, eggs, flour",Mix ingredients and bake until fudgy.
French Toast,"bread, eggs, milk, sugar, cinnamon","Dip bread in egg mixture, fry until golden."
Roasted Vegetables,"carrots, potatoes, zucchini, olive oil, rosemary",Bake vegetables with olive oil and rosemary.
Mashed Potatoes,"potatoes, butter, milk, salt","Mash boiled potatoes with butter and milk, season."
Frittata,"eggs, spinach, cheese, tomatoes, onions",Bake eggs with vegetables and cheese.
Stuffed Bell Peppers,"bell peppers, rice, beef, tomatoes, cheese","Fill peppers with rice, beef, and tomatoes, bake."
Chicken Burrito,"tortilla, chicken, rice, beans, salsa","Wrap chicken, rice, and beans in a tortilla."
Caprese Salad,"tomatoes, mozzarella, basil, olive oil, balsamic","Layer tomatoes with mozzarella and basil, drizzle with oil."
Ratatouille,"eggplant, zucchini, tomatoes, garlic, olive oil",Bake vegetables with garlic and olive oil.
Grilled Vegetables,"zucchini, eggplant, peppers, olive oil",Grill vegetables with olive oil until tender.
Stuffed Mushrooms,"mushrooms, cheese, breadcrumbs, garlic","Stuff mushrooms with cheese and breadcrumbs, bake."
Spinach Omelette,"eggs, spinach, cheese, milk",Cook eggs with spinach and cheese.
Roasted Chicken,"chicken, garlic, rosemary, olive oil, lemon",Roast chicken with garlic and rosemary.
Seafood Paella,"rice, shrimp, mussels, peas, saffron","Cook rice with seafood, saffron, and vegetables."
Vegetable Burger,"beans, breadcrumbs, onions, lettuce, bun","Make patties with beans, grill, and serve in a bun."
Guacamole,"avocado, tomatoes, onion, lime, salt",Mash avocado with tomatoes and lime.
Stuffed Zucchini,"zucchini, rice, tomatoes, cheese, garlic","Fill zucchini with rice and tomatoes, bake until tender."
Banana Salad,"banana, garlic",Combine banana and garlic. Cook until done. Adjust seasoning to taste. Serve hot.
Carrots Skillet,"carrots, bun, shrimp","Combine carrots, bun and shrimp. Cook until done. Adjust seasoning to taste. Serve hot."
Parmesan Tart,"parmesan, bananas, banana, breadcrumbs, croutons, curry powder","Combine parmesan, bananas, banana, breadcrumbs, croutons and curry powder. Cook until done. Adjust seasoning to taste. Serve hot."
Banana Casserole,"banana, spinach, coconut milk, shrimp, onions, cucumber","Combine banana, spinach, coconut milk, shrimp, onions and cucumber. Cook until done. Adjust seasoning to taste. Serve hot."
Garlic Bake,"garlic, apples, chicken, parmesan, lime, zucchini","Combine garlic, apples, chicken, parmesan, lime and zucchini. Cook until done. Adjust seasoning to taste. Serve hot."
Lime Pasta,"lime, bun, breadcrumbs","Combine lime, bun and breadcrumbs. Cook until done. Adjust seasoning to taste. Serve hot."
Milk Frittata,"milk, mayonnaise",Combine milk and mayonnaise. Cook until done. Adjust seasoning to taste. Serve hot.
Basil Pasta,"basil, pepper, salt, cabbage","Combine basil, pepper, salt and cabbage. Cook until done. Adjust seasoning to taste. Serve hot."
Soy Sauce Frittata,"soy sauce, honey",Combine soy sauce and honey. Cook until done. Adjust seasoning to taste. Serve hot.
Sugar Salad,"sugar, cocoa powder, bell peppers, basil","Combine sugar, cocoa powder, bell peppers and basil. Cook until done. Adjust seasoning to taste. Serve hot."
Bread Soup,"bread, curry powder, broth, mushrooms","Combine bread, curry powder, broth and mushrooms. Cook until done. Adjust seasoning to taste. Serve hot."
Vinegar Salad,"vinegar, mixed vegetables, chicken, mozzarella, milk","Combine vinegar, mixed vegetables, chicken, mozzarella and milk. Cook until done. Adjust seasoning to taste. Serve hot."
Water Bake,"water, blueberries, tortilla, vinegar","Combine water, blueberries, tortilla and vinegar. Cook until done. Adjust seasoning to taste. Serve hot."
Eggplant Salad,"eggplant, chicken, peppers, mushrooms, flour, spinach","Combine eggplant, chicken, peppers, mushrooms, flour and spinach. Cook until done. Adjust seasoning to taste. Serve hot."
Beef Pasta,"beef, curry powder, bananas, lemons","Combine beef, curry powder, bananas and lemons. Cook until done. Adjust seasoning to taste. Serve hot."
Bell Peppers Salad,"bell peppers, croutons, strawberries, lemons","Combine bell peppers, croutons, strawberries and lemons. Cook until done. Adjust seasoning to taste. Serve hot."
Mustard Bake,"mustard, water, pepper, celery, fish","Combine mustard, water, pepper, celery and fish. Cook until done. Adjust seasoning to taste. Serve hot."
Spinach Frittata,"spinach, salt, fish","Combine spinach, salt and fish. Cook until done. Adjust seasoning to taste. Serve hot."
Tomato Tart,"tomato, olive oil, mixed vegetables, cucumber, carrots","Combine tomato, olive oil, mixed vegetables, cucumber and carrots. Cook until done. Adjust seasoning to taste. Serve hot."
Breadcrumbs Bake,"breadcrumbs, beans, butter, cheese, vegetables","Combine breadcrumbs, beans, butter, cheese and vegetables. Cook until done. Adjust seasoning to taste. Serve hot."
Tomatoes Tart,"tomatoes, bell peppers, mussels, mushrooms, peppers","Combine tomatoes, bell peppers, mussels, mushrooms and peppers. Cook until done. Adjust seasoning to taste. Serve hot."
Soy Sauce Soup,"soy sauce, avocado, butter, salt","Combine soy sauce, avocado, butter and salt. Cook until done. Adjust seasoning to taste. Serve hot."
Butter Casserole,"butter, honey, parsley, chicken","Combine butter, honey, parsley and chicken. Cook until done. Adjust seasoning to taste. Serve hot."
Fish Bake,"fish, rosemary",Combine fish and rosemary. Cook until done. Adjust seasoning to taste. Serve hot.
Bun Salad,"bun, vegetables, lamb, vinegar, rosemary, tortilla","Combine bun, vegetables, lamb, vinegar, rosemary and tortilla. Cook until done. Adjust seasoning to taste. Serve hot."
Mozzarella Tart,"mozzarella, chicken, shrimp","Combine mozzarella, chicken and shrimp. Cook until done. Adjust seasoning to taste. Serve hot."
Tomatoes Casserole,"tomatoes, lentils",Combine tomatoes and lentils. Cook until done. Adjust seasoning to taste. Serve hot.
Butter Soup,"butter, mixed vegetables",Combine butter and mixed vegetables. Cook until done. Adjust seasoning to taste. Serve hot.
Beef Skillet,"beef, dill, strawberries","Combine beef, dill and strawberries. Cook until done. Adjust seasoning to taste. Serve hot."
Pumpkin Tart,"pumpkin, bell peppers",Combine pumpkin and bell peppers. Cook until done. Adjust seasoning to taste. Serve hot.
Caesar Dressing Tart,"caesar dressing, zucchini, pie crust","Combine caesar dressing, zucchini and pie crust. Cook until done. Adjust seasoning to taste. Serve hot."
Fish Pasta,"fish, salsa, tortilla","Combine fish, salsa and tortilla. Cook until done. Adjust seasoning to taste. Serve hot."
Shrimp Pasta,"shrimp, coconut milk, lemon","Combine shrimp, coconut milk and lemon. Cook until done. Adjust seasoning to taste. Serve hot."
Pasta Salad,"pasta, salmon, peas, cabbage","Combine pasta, salmon, peas and cabbage. Cook until done. Adjust seasoning to taste. Serve hot."
Bell Peppers Frittata,"bell peppers, lime, balsamic","Combine bell peppers, lime and balsamic. Cook until done. Adjust seasoning to taste. Serve hot."
Curry Powder Salad,"curry powder, tomato sauce, cucumber, apples, blueberries, beef","Combine curry powder, tomato sauce, cucumber, apples, blueberries and beef. Cook until done. Adjust seasoning to taste. Serve hot."
Bananas Skillet,"bananas, lettuce",Combine bananas and lettuce. Cook until done. Adjust seasoning to taste. Serve hot.
Dill Frittata,"dill, garlic, pumpkin, croutons, shrimp, caesar dressing","Combine dill, garlic, pumpkin, croutons, shrimp and caesar dressing. Cook until done. Adjust seasoning to taste. Serve hot."
Pie Crust Skillet,"pie crust, eggplant, zucchini, onion, cocoa powder, broth","Combine pie crust, eggplant, zucchini, onion, cocoa powder and broth. Cook until done. Adjust seasoning to taste. Serve hot."
Milk Skillet,"milk, parmesan, onion, peppers, beans","Combine milk, parmesan, onion, peppers and beans. Cook until done. Adjust seasoning to taste. Serve hot."
Olive Oil Skillet,"olive oil, lime",Combine olive oil and lime. Cook until done. Adjust seasoning to taste. Serve hot.
Cocoa Powder Bake,"cocoa powder, salt, peas","Combine cocoa powder, salt and peas. Cook until done. Adjust seasoning to taste. Serve hot."
Cinnamon Casserole,"cinnamon, garlic, peppers, eggplant, blueberries","Combine cinnamon, garlic, peppers, eggplant and blueberries. Cook until done. Adjust seasoning to taste. Serve hot."
Broth Bake,"broth, beans, shrimp, avocado, breadcrumbs, dill","Combine broth, beans, shrimp, avocado, breadcrumbs and dill. Cook until done. Adjust seasoning to taste. Serve hot."
Pumpkin Bake,"pumpkin, potatoes, croutons, olive oil, beef","Combine pumpkin, potatoes, croutons, olive oil and beef. Cook until done. Adjust seasoning to taste. Serve hot."
Apples Pasta,"apples, mussels, fish, pepper, ginger","Combine apples, mussels, fish, pepper and ginger. Cook until done. Adjust seasoning to taste. Serve hot."
Zucchini Delight,"zucchini, pumpkin, cheese, cocoa powder, honey, croutons","Combine zucchini, pumpkin, cheese, cocoa powder, honey and croutons. Cook until done. Adjust seasoning to taste. Serve hot."
Shrimp Casserole,"shrimp, beef, lemons, yogurt, beans, tomato","Combine shrimp, beef, lemons, yogurt, beans and tomato. Cook until done. Adjust seasoning to taste. Serve hot."
Salsa Skillet,"salsa, chicken, beef, saffron, bread, cinnamon","Combine salsa, chicken, beef, saffron, bread and cinnamon. Cook until done. Adjust seasoning to taste. Serve hot."
Bell Peppers Frittata,"bell peppers, dill, olive oil, cabbage, strawberries, eggplant","Combine bell peppers, dill, olive oil, cabbage, strawberries and eggplant. Cook until done. Adjust seasoning to taste. Serve hot."
Basil Tart,"basil, tuna, bread, onions, tomato, strawberries","Combine basil, tuna, bread, onions, tomato and strawberries. Cook until done. Adjust seasoning to taste. Serve hot."
Fish Soup,"fish, cream, lemons, dill","Combine fish, cream, lemons and dill. Cook until done. Adjust seasoning to taste. Serve hot."
Caesar Dressing Skillet,"caesar dressing, water, lamb, pepper, lemons","Combine caesar dressing, water, lamb, pepper and lemons. Cook until done. Adjust seasoning to taste. Serve hot."
Pepper Frittata,"pepper, tuna",Combine pepper and tuna. Cook until done. Adjust seasoning to taste. Serve hot.
Blueberries Salad,"blueberries, salt",Combine blueberries and salt. Cook until done. Adjust seasoning to taste. Serve hot.
Fish Soup,"fish, caesar dressing, mayonnaise, bell peppers, eggplant, mozzarella","Combine fish, caesar dressing, mayonnaise, bell peppers, eggplant and mozzarella. Cook until done. Adjust seasoning to taste. Serve hot."
Pasta Frittata,"pasta, shrimp, lamb","Combine pasta, shrimp and lamb. Cook until done. Adjust seasoning to taste. Serve hot."
Avocado Skillet,"avocado, soy sauce, lamb, bun, carrots, fish","Combine avocado, soy sauce, lamb, bun, carrots and fish. Cook until done. Adjust seasoning to taste. Serve hot."
Soy Sauce Soup,"soy sauce, cheese",Combine soy sauce and cheese. Cook until done. Adjust seasoning to taste. Serve hot.
Tortilla Soup,"tortilla, cream, lime, vinegar","Combine tortilla, cream, lime and vinegar. Cook until done. Adjust seasoning to taste. Serve hot."
Pumpkin Delight,"pumpkin, eggs, beans, breadcrumbs, parmesan, garlic","Combine pumpkin, eggs, beans, breadcrumbs, parmesan and garlic. Cook until done. Adjust seasoning to taste. Serve hot."
Lettuce Soup,"lettuce, caesar dressing",Combine lettuce and caesar dressing. Cook until done. Adjust seasoning to taste. Serve hot.
Pasta Tart,"pasta, soy sauce, parmesan","Combine pasta, soy sauce and parmesan. Cook until done. Adjust seasoning to taste. Serve hot."
Butter Bake,"butter, blueberries",Combine butter and blueberries. Cook until done. Adjust seasoning to taste. Serve hot.
Bananas Bake,"bananas, mozzarella, tomato, soy sauce, celery, parsley","Combine bananas, mozzarella, tomato, soy sauce, celery and parsley. Cook until done. Adjust seasoning to taste. Serve hot."
Lemon Delight,"lemon, mixed vegetables",Combine lemon and mixed vegetables. Cook until done. Adjust seasoning to taste. Serve hot.
Cream Tart,"cream, eggplant, bun, milk","Combine cream, eggplant, bun and milk. Cook until done. Adjust seasoning to taste. Serve hot."
Tuna Pasta,"tuna, cheese, dill, chicken, chocolate","Combine tuna, cheese, dill, chicken and chocolate. Cook until done. Adjust seasoning to taste. Serve hot."
Chocolate Pasta,"chocolate, lettuce",Combine chocolate and lettuce. Cook until done. Adjust seasoning to taste. Serve hot.
Flour Pasta,"flour, chicken, bun","Combine flour, chicken and bun. Cook until done. Adjust seasoning to taste. Serve hot."
Pie Crust Salad,"pie crust, cucumber",Combine pie crust and cucumber. Cook until done. Adjust seasoning to taste. Serve hot.
Mayonnaise Salad,"mayonnaise, lemon, curry powder, cucumber, banana","Combine mayonnaise, lemon, curry powder, cucumber and banana. Cook until done. Adjust seasoning to taste. Serve hot."
Lettuce Tart,"lettuce, garlic, bell peppers, mayonnaise, water","Combine lettuce, garlic, bell peppers, mayonnaise and water. Cook until done. Adjust seasoning to taste. Serve hot."
Salt Bake,"salt, lettuce, banana, butter, fish","Combine salt, lettuce, banana, butter and fish. Cook until done. Adjust seasoning to taste. Serve hot."
Fish Stir-Fry,"fish, bananas, bun, tomatoes, parsley, mayonnaise","Combine fish, bananas, bun, tomatoes, parsley and mayonnaise. Cook until done. Adjust seasoning to taste. Serve hot."
Tortilla Salad,"tortilla, saffron, butter, mussels, sugar","Combine tortilla, saffron, butter, mussels and sugar. Cook until done. Adjust seasoning to taste. Serve hot."
Basil Tart,"basil, parsley, apples, salmon","Combine basil, parsley, apples and salmon. Cook until done. Adjust seasoning to taste. Serve hot."
Mixed Vegetables Stir-Fry,"mixed vegetables, parsley, bell peppers","Combine mixed vegetables, parsley and bell peppers. Cook until done. Adjust seasoning to taste. Serve hot."
Lemons Stir-Fry,"lemons, cabbage, lamb, rosemary, lemon, onion","Combine lemons, cabbage, lamb, rosemary, lemon and onion. Cook until done. Adjust seasoning to taste. Serve hot."
Honey Pasta,"honey, soy sauce, caesar dressing, cocoa powder, onions","Combine honey, soy sauce, caesar dressing, cocoa powder and onions. Cook until done. Adjust seasoning to taste. Serve hot."
Tortillas Pasta,"tortillas, strawberries, lamb","Combine tortillas, strawberries and lamb. Cook until done. Adjust seasoning to taste. Serve hot."
Apples Frittata,"apples, lamb, ginger, cream, parsley, tomato","Combine apples, lamb, ginger, cream, parsley and tomato. Cook until done. Adjust seasoning to taste. Serve hot."
Peppers Casserole,"peppers, pasta, croutons, saffron","Combine peppers, pasta, croutons and saffron. Cook until done. Adjust seasoning to taste. Serve hot."
Zucchini Tart,"zucchini, bread, ginger","Combine zucchini, bread and ginger. Cook until done. Adjust seasoning to taste. Serve hot."
Lettuce Bake,"lettuce, breadcrumbs, dill, lemon, cucumber, coconut milk","Combine lettuce, breadcrumbs, dill, lemon, cucumber and coconut milk. Cook until done. Adjust seasoning to taste. Serve hot."
Basil Casserole,"basil, eggplant",Combine basil and eggplant. Cook until done. Adjust seasoning to taste. Serve hot.
Blueberries Pasta,"blueberries, pepper, onions, vegetables, sugar, cocoa powder","Combine blueberries, pepper, onions, vegetables, sugar and cocoa powder. Cook until done. Adjust seasoning to taste. Serve hot."
Olive Oil Skillet,"olive oil, eggplant, celery, yogurt, apples","Combine olive oil, eggplant, celery, yogurt and apples. Cook until done. Adjust seasoning to taste. Serve hot."
Cucumber Tart,"cucumber, chocolate, salmon, peppers, beans","Combine cucumber, chocolate, salmon, peppers and beans. Cook until done. Adjust seasoning to taste. Serve hot."
Cabbage Casserole,"cabbage, pepper, carrots","Combine cabbage, pepper and carrots. Cook until done. Adjust seasoning to taste. Serve hot."
Spinach Pasta,"spinach, tomatoes, lemons, pasta, tortillas, rosemary","Combine spinach, tomatoes, lemons, pasta, tortillas and rosemary. Cook until done. Adjust seasoning to taste. Serve hot."
Peas Soup,"peas, chicken, pie crust, zucchini, fish, eggplant","Combine peas, chicken, pie crust, zucchini, fish and eggplant. Cook until done. Adjust seasoning to taste. Serve hot."
Pumpkin Soup,"pumpkin, vegetables, dill, garlic, pasta, blueberries","Combine pumpkin, vegetables, dill, garlic, pasta and blueberries. Cook until done. Adjust seasoning to taste. Serve hot."
Flour Tart,"flour, lettuce, lemons","Combine flour, lettuce and lemons. Cook until done. Adjust seasoning to taste. Serve hot."
Carrots Salad,"carrots, cheese",Combine carrots and cheese. Cook until done. Adjust seasoning to taste. Serve hot.
Cheese Stir-Fry,"cheese, croutons, bell peppers, onions, onion","Combine cheese, croutons, bell peppers, onions and onion. Cook until done. Adjust seasoning to taste. Serve hot."
Peppers Frittata,"peppers, onions, beef, cream, yogurt, mussels","Combine peppers, onions, beef, cream, yogurt and mussels. Cook until done. Adjust seasoning to taste. Serve hot."
Sugar Casserole,"sugar, mushrooms",Combine sugar and mushrooms. Cook until done. Adjust seasoning to taste. Serve hot.
Milk Pasta,"milk, lamb",Combine milk and lamb. Cook until done. Adjust seasoning to taste. Serve hot.
Salt Salad,"salt, shrimp, tortilla, cucumber, pumpkin","Combine salt, shrimp, tortilla, cucumber and pumpkin. Cook until done. Adjust seasoning to taste. Serve hot."
Parsley Stir-Fry,"parsley, pumpkin, banana, mussels","Combine parsley, pumpkin, banana and mussels. Cook until done. Adjust seasoning to taste. Serve hot."
Chickpeas Delight,"chickpeas, peppers, caesar dressing, tuna, salt","Combine chickpeas, peppers, caesar dressing, tuna and salt. Cook until done. Adjust seasoning to taste. Serve hot."
Tomato Sauce Pasta,"tomato sauce, strawberries, zucchini, banana, bread","Combine tomato sauce, strawberries, zucchini, banana and bread. Cook until done. Adjust seasoning to taste. Serve hot."
Peppers Soup,"peppers, cinnamon, beans","Combine peppers, cinnamon and beans. Cook until done. Adjust seasoning to taste. Serve hot."
Lentils Soup,"lentils, croutons, pepper, lime, mushrooms","Combine lentils, croutons, pepper, lime and mushrooms. Cook until done. Adjust seasoning to taste. Serve hot."
Eggs Delight,"eggs, bread, pie crust, balsamic, shrimp","Combine eggs, bread, pie crust, balsamic and shrimp. Cook until done. Adjust seasoning to taste. Serve hot."
Cucumber Delight,"cucumber, yogurt, bell peppers, basil","Combine cucumber, yogurt, bell peppers and basil. Cook until done. Adjust seasoning to taste. Serve hot."
Coconut Milk Bake,"coconut milk, balsamic, tuna","Combine coconut milk, balsamic and tuna. Cook until done. Adjust seasoning to taste. Serve hot."
Caesar Dressing Frittata,"caesar dressing, pie crust, butter","Combine caesar dressing, pie crust and butter. Cook until done. Adjust seasoning to taste. Serve hot."
Peppers Bake,"peppers, eggs, mozzarella","Combine peppers, eggs and mozzarella. Cook until done. Adjust seasoning to taste. Serve hot."
Tortilla Delight,"tortilla, butter, chicken, lemon, bun, tomato","Combine tortilla, butter, chicken, lemon, bun and tomato. Cook until done. Adjust seasoning to taste. Serve hot."
Sugar Skillet,"sugar, mushrooms, mustard, coconut milk","Combine sugar, mushrooms, mustard and coconut milk. Cook until done. Adjust seasoning to taste. Serve hot."
Vegetables Frittata,"vegetables, eggplant, bun, lamb, tomatoes, cabbage","Combine vegetables, eggplant, bun, lamb, tomatoes and cabbage. Cook until done. Adjust seasoning to taste. Serve hot."
Mayonnaise Pasta,"mayonnaise, salt",Combine mayonnaise and salt. Cook until done. Adjust seasoning to taste. Serve hot.
Bell Peppers Delight,"bell peppers, rosemary, water, lime","Combine bell peppers, rosemary, water and lime. Cook until done. Adjust seasoning to taste. Serve hot."
Pumpkin Casserole,"pumpkin, bun, parsley, mixed vegetables, vinegar","Combine pumpkin, bun, parsley, mixed vegetables and vinegar. Cook until done. Adjust seasoning to taste. Serve hot."
Parsley Soup,"parsley, chocolate, salmon","Combine parsley, chocolate and salmon. Cook until done. Adjust seasoning to taste. Serve hot."
Salt Stir-Fry,"salt, potatoes, peppers, parsley, tomato sauce, flour","Combine salt, potatoes, peppers, parsley, tomato sauce and flour. Cook until done. Adjust seasoning to taste. Serve hot."
Breadcrumbs Salad,"breadcrumbs, garlic, peas","Combine breadcrumbs, garlic and peas. Cook until done. Adjust seasoning to taste. Serve hot."
Strawberries Casserole,"strawberries, tortillas, mushrooms, lime, banana","Combine strawberries, tortillas, mushrooms, lime and banana. Cook until done. Adjust seasoning to taste. Serve hot."
Cinnamon Soup,"cinnamon, pumpkin, croutons, milk","Combine cinnamon, pumpkin, croutons and milk. Cook until done. Adjust seasoning to taste. Serve hot."
